{
  "$schema": "https://static.modelcontextprotocol.io/schemas/2025-12-11/server.schema.json",
  "name": "sh.tocsin/tocsin",
  "title": "Tocsin",
  "description": "Security advisories, built for agents.",
  "version": "0.1.0",
  "websiteUrl": "https://tocsin.sh",
  "repository": {
    "url": "https://github.com/Fortunian/tocsin",
    "source": "github"
  },
  "remotes": [
    {
      "type": "streamable-http",
      "url": "https://mcp.tocsin.sh/mcp"
    }
  ]
}
